image_name,english_caption,persian_caption
alex-gruber-POhtpsLad9Y-unsplash.jpg,"The image depicts a breathtaking mountain landscape under a partly cloudy sky. The main subject is a towering mountain peak, which dominates the scene with its rugged, rocky surface. The peak is surrounded by a mix of greenery and open fields, indicating a transition from forested areas to more open spaces.  The sky above is a vibrant blue, with scattered white clouds that add depth and dimension to the scene. The lighting suggests it is either late morning or early afternoon, as the sun casts soft shadows and highlights the textures of the mountains and vegetation.  In the foreground, there is a grassy field that extends towards the base of the mountain. This field is dotted with patches of greenery, likely indicating a mix of grasses and small plants. The field appears to be well-maintained, possibly a pasture or a managed agricultural area.  The background features additional mountain peaks, creating a sense of scale and grandeur. These peaks are less prominent but still contribute to the overall majesty of the landscape. The distant mountains are partially obscured by the clouds, adding a layer of mystery and depth to the scene.  The composition of the image is balanced, with the mountain peak centrally located and the field in the foreground providing a natural frame. The contrast between the dark, rocky mountain and the lighter, more open fields creates a visually striking effect.  Overall, the image captures the serene and awe-inspiring beauty of a mountainous landscape, with a clear emphasis on the natural elements and the interplay of light and shadow. The atmosphere is calm and tranquil, inviting viewers to appreciate the grandeur and tranquility of nature.",این تصویر یک منظره طبیعی زیبا و بزرگ از کوهستان را نشان می‌دهد. در پشت صحنه، قله‌های بلند و شیروانی کوه‌ها با سطح‌های سنگی و خشک در حالی که در پوشش چوبی قرار دارند، قله‌های بلند و شیروانی کوه‌ها با سطح‌های سنگی و خشک در حالی که در پوشش چوبی قرار دارند، قله‌های بلند و شیروانی کوه‌ها با سطح‌های سنگی و خشک در حالی که در پوشش چوبی قرار دارند، قله‌های بلند و شیروانی کوه‌ها با سطح‌های سنگی و خشک در حالی که در پوشش چوبی قرار دارند، قله‌های بلند و شیروانی کوه‌ها با سطح‌های سنگی و خشک در حالی که در پوشش چوبی قرار دارند، قله‌های بلند و شیروانی کوه‌ها با سطح‌های سنگی و خشک در حالی که در پوشش چوبی قرار دارند، قله‌های بلند و شیروانی کوه‌ها با سطح‌های سنگی و خشک در حالی که در پوشش چوبی قرار دارند، قله‌های بلند و شیروانی کوه‌ها با سطح‌های سنگی و خشک در حالی که در پوشش چوبی قرار دارند، قله‌های بلند و شیروانی کوه‌ها با سطح‌های سنگی و خشک در حالی که در پوشش چوبی قرار دارند، قله‌های بلند و شیروانی کوه‌ها با سطح‌های سنگی و خشک در حالی که در پوشش چوبی قرار دارند، قله‌های بلند و شیروانی کوه‌ها با سطح‌های سنگی و خشک در حالی که در پوشش چوبی قرار دارند، قله‌های بلند و شیروانی کوه‌ها با سطح‌های سنگی و خشک در حالی که در پوشش چوبی قرار دارند، قله‌های بلند و شیروانی کوه‌ها با سطح‌های سنگی و خشک در حالی که در پوشش چوبی قرار دارند، قله‌های بلند و شیروانی کوه‌ها با سطح‌های سنگی و خشک در حالی که در پوشش چوبی قرار دارند، قله‌های بلند و شیروانی کوه‌ها با سطح‌های سنگی و خشک در حالی که در پوشش چوبی قرار دارند، قله‌های بلند و شیروانی کوه‌ها با سطح‌های سنگی و خشک در حالی که در پوشش چوبی قرار دارند، قله‌های بلند و شیروانی کوه‌ها با سطح‌های سنگی و خشک در حالی که در پوشش چوبی قرار دارند، قله‌های بلند و شیروانی کوه‌ها با سطح‌های سنگی و خشک در حالی که در پوشش چوبی قرار دارند، قله‌های بلند و شیروانی کوه‌ها با سطح‌های سنگی و خشک در حالی که در پوشش چوبی قرار دارند، قله‌های بلند و شیروانی کوه‌ها با سطح‌های سنگی و خ
laura-chouette-W-7k72ThEr0-unsplash.jpg,"The image features a close-up view of a stylish handbag and a watch placed on a light-colored, textured surface that appears to be a bed or a blanket. The handbag is prominently displayed in the foreground, with its design and details clearly visible.  ### Main Subjects: 1. **Handbag**:     - **Color**: The handbag has a combination of dark green and black leather.    - **Design**: It has a structured, rectangular shape with a flap closure secured by a metal clasp. The clasp is adorned with a small, decorative piece.    - **Chain Detail**: A chain strap is attached to the bag, adding an elegant touch.    - **Label**: There is a small label on the front of the bag, though the text is not legible in the image.  2. **Watch**:    - **Color**: The watch has a rose gold or gold-tone case with a white face.    - **Details**: The watch has a classic design with a round face and a simple, elegant band.    - **Strap**: The strap of the watch is also rose gold or gold-toned, matching the case.  ### Colors: - The handbag is primarily dark green with black accents. - The watch is rose gold or gold-toned. - The background is a light, neutral color, possibly beige or off-white, which contrasts with the darker tones of the handbag and watch.  ### Lighting: - The lighting in the image is soft and diffused, creating gentle shadows and highlighting the textures of the materials. - The overall tone of the image is warm and inviting, suggesting a cozy indoor setting.  ### Composition: - The handbag is positioned slightly to the left of the frame, with the watch hanging from it. - The background is blurred, drawing attention to the handbag and watch as the main subjects. - The composition is balanced, with the handbag taking up a significant portion of the frame.  ### Background Elements: - The background is a light, neutral color, likely a bed or a blanket, which provides a soft and comfortable backdrop. - The texture of the background is smooth and slightly wrinkled, adding a casual, lived-in feel to the scene.  ### Spatial Relationships: - The handbag and watch are closely positioned, with the watch hanging from the strap of the bag. - The handbag is slightly tilted, giving a dynamic feel to the composition. - The background is out of focus, ensuring that the handbag and watch remain the focal points.  ### Notable Details and Atmosphere: - The overall atmosphere of the image is sophisticated and stylish, with a touch of elegance. - The use of soft lighting and neutral colors creates a calm and inviting mood. - The combination of the dark handbag and the rose gold watch adds a subtle contrast, making the scene visually appealing.  This detailed description should provide a comprehensive understanding of the image, allowing a pure text model to answer related questions effectively.",عذرًا، امکان نمایش تصویر وجود ندارد. اگر می‌توانید تصویر را ارسال کنید، من بتوانم به شما کمک کنم.
johannes-andersson-UCd78vfC8vU-unsplash.jpg,"The image depicts a serene and picturesque landscape featuring two deer grazing in a grassy field. The main subjects are the deer, which are positioned towards the bottom right of the frame. One deer is closer to the foreground, while the other is slightly behind it, both appearing to be engaged in feeding on the tall, green grass.  The background consists of a majestic mountain range with a prominent, steep cliff face that rises dramatically from the valley floor. The cliff is covered with patches of vegetation, including some trees and shrubs, adding texture and depth to the scene. The mountain's surface is rugged and uneven, with visible striations and crevices.  The sky above is clear with a soft gradient of light blue, suggesting either early morning or late afternoon lighting. The sunlight casts gentle shadows and highlights on the mountains, creating a warm and inviting atmosphere. The overall color palette of the image includes various shades of green from the grass and trees, gray from the rocky mountains, and a soft blue from the sky.  The composition of the image is balanced, with the deer in the foreground drawing immediate attention, while the towering mountain in the background provides a sense of scale and grandeur. The spatial relationship between the deer and the mountain creates a harmonious balance, emphasizing the natural beauty and tranquility of the scene.  Notable details include the intricate textures of the grass, the ruggedness of the mountain, and the subtle play of light and shadow. The overall atmosphere is peaceful and serene, capturing the essence of a quiet moment in nature.",این تصویر یک منظره طبیعی زیبا را نشان می‌دهد که در آن دو گوزن در حال خوردن در یک پارک گردشگری است. در سمت چپ تصویر، درختان بلوط بلند و سبز در حال گرماست و در سمت راست، درختان کاج و درختان چوبی دیگری وجود دارد. در سمت بالا، در سمت چپ تصویر، قله‌ای بلند و بلند با رنگ‌های قرمز و سفید در حال گرماست. در سمت راست، در سمت چپ تصویر، درختان کاج و درختان چوبی دیگری وجود دارد. در سمت راست، در سمت چپ تصویر، درختان کاج و درختان چوبی دیگری وجود دارد. در سمت راست، در سمت چپ تصویر، درختان کاج و درختان چوبی دیگری وجود دارد. در سمت راست، در سمت چپ تصویر، درختان کاج و درختان چوبی دیگری وجود دارد. در سمت راست، در سمت چپ تصویر، درختان کاج و درختان چوبی دیگری وجود دارد. در سمت راست، در سمت چپ تصویر، درختان کاج و درختان چوبی دیگری وجود دارد. در سمت راست، در سمت چپ تصویر، درختان کاج و درختان چوبی دیگری وجود دارد. در سمت راست، در سمت چپ تصویر، درختان کاج و درختان چوبی دیگری وجود دارد. در سمت راست، در سمت چپ تصویر، درختان کاج و درختان چوبی دیگری وجود دارد. در سمت راست، در سمت چپ تصویر، درختان کاج و درختان چوبی دیگری وجود دارد. در سمت راست، در سمت چپ تصویر، درختان کاج و درختان چوبی دیگری وجود دارد. در سمت راست، در سمت چپ تصویر، درختان کاج و درختان چوبی دیگری وجود دارد. در سمت راست، در سمت چپ تصویر، درختان کاج و درختان چوبی دیگری وجود دارد. در سمت راست، در سمت چپ تصویر، درختان کاج و درختان چوبی دیگری وجود دارد. در سمت راست، در سمت چپ تصویر، درختان کاج و درختان چوبی دیگری وجود دارد. در سمت راست، در سمت چپ تصویر، درختان کاج و درختان چوبی دیگری وجود دارد. در سمت راست، در سمت چپ تصویر، درختان کاج و درختان چوبی دیگری وجود دارد. در سمت راست، در سمت چپ تصویر، درختان کاج و درختان چوبی دیگری وجود دارد. در سمت راست، در سمت چپ تصویر، درختان کاج و درختان چوبی دیگری وجود دارد. در سمت راست، در سمت چپ تصویر، درختان کاج و درختان چوبی دیگری وجود دارد. در سمت راست، در سمت چپ تصویر، درختان کاج و درختان چوبی دیگری وجود دارد. در سمت راست، در سمت چپ تصویر، درختان کاج و درختان چوبی دیگری وجود دارد. در سمت راست، در سمت چپ تصویر، درختان کاج و در
lum3n--RBuQ2PK_L8-unsplash.jpg,"The image features a minimalist workspace setup on a light pink background. The main subjects in the image include a white keyboard, a white mouse, a pair of white headphones, a white notebook, and a silver pen.  1. **Keyboard**: Positioned centrally, the keyboard is sleek and modern with a clean, white design. It has a numeric keypad on the right side and a trackpad at the bottom. The keys are evenly spaced, and the layout is standard QWERTY.  2. **Mouse**: To the right of the keyboard, there is a white Apple Magic Mouse. It has a sleek design with a built-in trackpad and a single button on top.  3. **Headphones**: On the left side of the image, there is a pair of white headphones. They have a classic design with a headband and ear cups that cover the ears completely.  4. **Notebook**: To the right of the keyboard, there is a white notebook with a silver pen resting on top. The notebook appears to be closed and has a simple, clean design.  5. **Pen**: The silver pen is placed on top of the notebook, leaning slightly to the right. Its metallic sheen contrasts with the softness of the notebook and the other items.  6. **Background**: The entire background is a solid light pink color, providing a neutral and calming backdrop for the white and silver objects. The lighting is soft and even, highlighting the items without creating harsh shadows.  7. **Composition**: The items are arranged in a neat, organized manner, suggesting a tidy and efficient workspace. The keyboard and mouse are placed directly in front of each other, while the headphones are positioned to the left, and the notebook and pen are placed to the right. This arrangement creates a balanced and symmetrical composition.  8. **Atmosphere**: The overall atmosphere of the image is calm, organized, and modern. The use of white and silver against the light pink background gives it a clean and minimalist feel. The lighting enhances the simplicity and elegance of the workspace setup.  In summary, the image depicts a well-organized, modern workspace with a focus on minimalism and simplicity. The items are neatly arranged, and the soft lighting contributes to a serene and professional atmosphere.",این تصویر شامل چند مورد ابزار کاربردی است که روی یک صفحه صورتی قرار دارند:  1. **کیبورد**: در قسمت پایین تصویر، یک کیبورد سفید و ساده قرار دارد. این کیبورد شامل تمام کلیدهای متنی و نمایشگر صفحه نمایش است.  2. **کیس**: در بالای کیبورد، یک کیس سفید قرار دارد. این کیس شامل یک مداد و یک کتاب است.  3. **کیس**: در بالای کیس، یک کیس دیگر وجود دارد که شامل یک کتاب و یک مداد است.  4. **کیس**: در بالای کیس دوم، یک کیس دیگر قرار دارد که شامل یک کتاب و یک مداد است.  5. **کیس**: در بالای کیس سوم، یک کیس دیگر قرار دارد که شامل یک کتاب و یک مداد است.  6. **کیس**: در بالای کیس چهارم، یک کیس دیگر قرار دارد که شامل یک کتاب و یک مداد است.  7. **کیس**: در بالای کیس پنجم، یک کیس دیگر قرار دارد که شامل یک کتاب و یک مداد است.  8. **کیس**: در بالای کیس ششم، یک کیس دیگر قرار دارد که شامل یک کتاب و یک مداد است.  9. **کیس**: در بالای کیس هفتم، یک کیس دیگر قرار دارد که شامل یک کتاب و یک مداد است.  10. **کیس**: در بالای کیس هشتم، یک کیس دیگر قرار دارد که شامل یک کتاب و یک مداد است.  11. **کیس**: در بالای کیس نهم، یک کیس دیگر قرار دارد که شامل یک کتاب و یک مداد است.  12. **کیس**: در بالای کیس دهم، یک کیس دیگر قرار دارد که شامل یک کتاب و یک مداد است.  13. **کیس**: در بالای کیس یازدهم، یک کیس دیگر قرار دارد که شامل یک کتاب و یک مداد است.  14. **کیس**: در بالای کیس دوازدهم، یک کیس دیگر قرار دارد که شامل یک کتاب و یک مداد است.  15. **کیس**: در بالای کیس سیزدهم، یک کیس دیگر قرار دارد که شامل یک کتاب و یک مداد است.  16. **کیس**: در بالای کیس بیستم، یک کیس دیگر قرار دارد که شامل یک کتاب و یک مداد است.  17. **کیس**: در بالای کیس بیست و یکم، یک کیس دیگر قرار دارد که شامل یک کتاب و یک مداد است.  18. **کیس**: در بالای کیس بیست و دوم، یک کیس دیگر قرار دارد که شامل یک کتاب و یک مداد است.  19. **کیس**: در بالای کیس بیست و سوم، یک کیس دیگر قرار دارد که شامل یک کتاب و یک مداد است.  20. **کیس**: در بالای کیس بیست و چهارم، یک کیس دیگر قرار دارد که شامل یک کتاب
christian-bowen-nmI9fp1geO8-unsplash.jpg,"The image depicts a family of three sitting on a porch, with a white wooden railing in the foreground. The father is on the left, wearing a blue polo shirt and gray pants. He has short dark hair and is looking down at his hands. The mother is on the right, wearing a light pink sweater and blue pants. She has long brown hair and is smiling while looking at her son. The son, who is seated between them, is holding an ultrasound image and smiling at it.  The background shows a wooden fence and some greenery, suggesting a suburban setting. The lighting appears to be natural daylight, casting soft shadows and highlighting the family's expressions. The composition is casual and intimate, capturing a moment of shared joy and anticipation. The spatial relationship between the family members is close, with the son being the focal point as he holds the ultrasound image. The overall atmosphere is warm and affectionate, conveying a sense of happiness and togetherness.",در تصویر مشاهده می‌شود یک خانواده در حال تماس با یک عکس پرتویی است. این عکس پرتویی به شکل یک نوزاد نشسته روی یک صفحه نقره‌ای است.   - **پس‌زمینه**: در پشت خانواده، یک سیستم چوبی باز است که به طور عمومی به عنوان یک حیاط یا باغ می‌باشد. در پشت سیستم چوبی، درختان قابل مشاهده هستند.  - **خانواده**:   - **مرد**: در کنار خانواده، مردی با لباس آبی کلاهبردار و پیراهن آبی است. او دست‌شان را بر روی پای زن می‌گذارد.   - **زن**: در کنار مرد، زنی با لباس آبی کلاهبردار و پیراهن سفید است. او دست‌شان را بر روی پای مرد می‌گذارد.   - **نوزاد**: در میان مرد و زن، نوزادی با لباس آبی کلاهبردار و پیراهن آبی است. او عکس پرتویی را در دستان خود نشسته دارد.  - **امکانات**: در پشت خانواده، یک سیستم چوبی باز است که به طور عمومی به عنوان یک حیاط یا باغ می‌باشد. در پشت سیستم چوبی، درختان قابل مشاهده هستند.  - **امکانات**: در پشت خانواده، یک سیستم چوبی باز است که به طور عمومی به عنوان یک حیاط یا باغ می‌باشد. در پشت سیستم چوبی، درختان قابل مشاهده هستند.  - **امکانات**: در پشت خانواده، یک سیستم چوبی باز است که به طور عمومی به عنوان یک حیاط یا باغ می‌باشد. در پشت سیستم چوبی، درختان قابل مشاهده هستند.  - **امکانات**: در پشت خانواده، یک سیستم چوبی باز است که به طور عمومی به عنوان یک حیاط یا باغ می‌باشد. در پشت سیستم چوبی، درختان قابل مشاهده هستند.  - **امکانات**: در پشت خانواده، یک سیستم چوبی باز است که به طور عمومی به عنوان یک حیاط یا باغ می‌باشد. در پشت سیستم چوبی، درختان قابل مشاهده هستند.  - **امکانات**: در پشت خانواده، یک سیستم چوبی باز است که به طور عمومی به عنوان یک حیاط یا باغ می‌باشد. در پشت سیستم چوبی، درختان قابل مشاهده هستند.  - **امکانات**: در پشت خانواده، یک سیستم چوبی باز است که به طور عمومی به عنوان یک حیاط یا باغ می‌باشد. در پشت سیستم چوبی، درختان قابل مشاهده هستند.  - **امکانات**: در پشت خانواده، یک سیستم چوبی باز است که به طور عمومی به عنوان یک حیاط یا باغ می‌باشد. در پشت سیستم چوبی، درختان قابل مشاهده هستند.  - **امکانات**: در پشت خان
