image_name,english_caption,persian_caption
linkedin-sales-solutions-oFMI6CdD7yU-unsplash.jpg,"The image depicts two individuals sitting on a dark brown couch in what appears to be an office or modern living space with large glass windows. The main subjects are a man and a woman, both engaged in a conversation while looking at a laptop placed on a white coffee table in front of them.  **Main Subjects and Actions:** - The man is wearing a black shirt and dark pants. He has gray hair and is seated with his left hand resting on his chin, suggesting he is deep in thought or listening intently. - The woman is dressed in a white blouse and blue jeans. She is actively using the laptop, possibly showing something to the man or discussing its content.  **Colors:** - The couch is dark brown, providing a contrast to the lighter tones of the coffee table and the individuals' clothing. - The coffee table is white, which stands out against the darker couch. - The laptop is silver, blending subtly with the overall color scheme. - The woman's sandals are visible, adding a casual touch to her outfit.  **Lighting:** - The room is well-lit, likely due to natural light coming through the large glass windows. The lighting creates a bright and open atmosphere, enhancing the modern feel of the space.  **Composition:** - The composition is centered around the two individuals and the laptop, drawing attention to their interaction. - The coffee table serves as a focal point, with the books and laptop arranged neatly on it. - The background features large glass windows that allow natural light to flood the room, creating a sense of openness and connection to the outside world.  **Background Elements:** - Behind the individuals, there is a shelf filled with various items, including bottles and other objects, suggesting a well-stocked or organized space. - The floor is carpeted in a light color, complementing the overall neutral palette of the room.  **Spatial Relationships:** - The man and woman are seated close together on the couch, indicating a collaborative or intimate relationship between them. - The coffee table is positioned directly in front of them, facilitating easy access to the laptop and the books.  **Notable Details and Atmosphere:** - The overall atmosphere is professional yet relaxed, with a focus on productivity and collaboration. - The presence of the laptop and books suggests a work or study environment, but the casual seating and interaction hint at a more informal setting. - The large glass windows and natural light contribute to a bright and airy feel, making the space inviting and conducive to focused work or discussion.",این تصویر نشان می‌دهد یک مرد و یک زن در حال صحبت در یک اتاق پوشیده است. مرد در حالی که روی یک کوسن قرمز و سرخ قرار دارد، یک لپ‌تاپ را بر روی یک میز کافی شاپ نشسته است. زن در حالی که روی یک کوسن قرمز و سرخ قرار دارد، یک لپ‌تاپ را بر روی یک میز کافی شاپ نشسته است. زن در حالی که روی یک کوسن قرمز و سرخ قرار دارد، یک لپ‌تاپ را بر روی یک میز کافی شاپ نشسته است. زن در حالی که روی یک کوسن قرمز و سرخ قرار دارد، یک لپ‌تاپ را بر روی یک میز کافی شاپ نشسته است. زن در حالی که روی یک کوسن قرمز و سرخ قرار دارد، یک لپ‌تاپ را بر روی یک میز کافی شاپ نشسته است. زن در حالی که روی یک کوسن قرمز و سرخ قرار دارد، یک لپ‌تاپ را بر روی یک میز کافی شاپ نشسته است. زن در حالی که روی یک کوسن قرمز و سرخ قرار دارد، یک لپ‌تاپ را بر روی یک میز کافی شاپ نشسته است. زن در حالی که روی یک کوسن قرمز و سرخ قرار دارد، یک لپ‌تاپ را بر روی یک میز کافی شاپ نشسته است. زن در حالی که روی یک کوسن قرمز و سرخ قرار دارد، یک لپ‌تاپ را بر روی یک میز کافی شاپ نشسته است. زن در حالی که روی یک کوسن قرمز و سرخ قرار دارد، یک لپ‌تاپ را بر روی یک میز کافی شاپ نشسته است. زن در حالی که روی یک کوسن قرمز و سرخ قرار دارد، یک لپ‌تاپ را بر روی یک میز کافی شاپ نشسته است. زن در حالی که روی یک کوسن قرمز و سرخ قرار دارد، یک لپ‌تاپ را بر روی یک میز کافی شاپ نشسته است. زن در حالی که روی یک کوسن قرمز و سرخ قرار دارد، یک لپ‌تاپ را بر روی یک میز کافی شاپ نشسته است. زن در حالی که روی یک کوسن قرمز و سرخ قرار دارد، یک لپ‌تاپ را بر روی یک میز کافی شاپ نشسته است. زن در حالی که روی یک کوسن قرمز و سرخ قرار دارد، یک لپ‌تاپ را بر روی یک میز کافی شاپ نشسته است. زن در حالی که روی یک کوسن قرمز و سرخ قرار دارد، یک لپ‌تاپ را بر روی یک میز کافی شاپ نشسته است. زن در حالی که روی یک کوسن قرمز و سرخ قرار دارد، یک لپ‌تاپ را بر روی یک میز کافی شاپ نشسته است. زن در حالی که روی یک کوس
jacek-dylag-PMxT0XtQ--A-unsplash.jpg,"The image depicts a bustling urban street scene during what appears to be late afternoon or early evening, as indicated by the warm, golden sunlight casting long shadows. The main subjects in the foreground are a group of people crossing a wide, white-striped pedestrian crosswalk. The individuals are dressed in a mix of casual and semi-formal attire, suggesting a diverse crowd, possibly including both locals and tourists.  Key elements include: 1. **Main Subjects**: A diverse group of pedestrians, some walking briskly while others pause to look around. They are all engaged in various activities such as talking, looking at their phones, or simply observing their surroundings. 2. **Colors**: The scene is dominated by the warm hues of the sunset, with the sunlight creating a golden glow on the faces and clothing of the pedestrians. The crosswalk is stark white against the darker pavement, making it highly visible for crossing. 3. **Lighting**: The lighting is soft and diffused, typical of a setting sun, which enhances the overall mood of the scene. The shadows are long and dramatic, adding depth to the image. 4. **Composition**: The image is taken from a low angle, looking up at the pedestrians, which adds a sense of scale and perspective. The composition emphasizes the movement and activity of the crowd. 5. **Background Elements**: The background features a row of buildings with classical architectural styles, including arched doorways and ornate facades. There are also some trees and street lamps, contributing to the urban atmosphere. 6. **Spatial Relationships**: The pedestrians are spread out across the crosswalk, with some closer to the camera and others further away. The crosswalk itself is wide and clearly marked, ensuring safety for those crossing. 7. **Notable Details**: The sunlight creates a play of light and shadow, highlighting the textures of the pavement and the clothing of the pedestrians. The overall atmosphere is lively and dynamic, capturing a moment of everyday life in a busy city.  This image effectively conveys the energy and vibrancy of urban life, with the interplay of natural light and human activity creating a visually engaging scene.",این تصویر یک خیابان در شهری زیبا را نشان می‌دهد. در میان افرادی که در حال پیاده‌روی هستند، چندین شخصیت متفاوتی مشاهده می‌شوند. برخی از آنها لباس‌های رسمی را می‌پوشانند، در حالی که برخی دیگر لباس‌های کارآمد را بر روی سر و شانه‌ها دارند.  در پس‌زمینه، ساختمان‌های بلند و زیبایی وجود دارد که از طرفین خیابان بیرون می‌آیند. این ساختمان‌ها معمولاً با سقف‌های سنگی و دیوارهای بلندی ساخته شده‌اند. در بالای ساختمان‌ها، پنجره‌های بزرگی وجود دارند که نور خورشید را به داخل ساختمان‌ها می‌برند.  در طول خیابان، دو طرفین باز است و از طرفین به طرفین، افراد مختلفی در حال پیاده‌روی هستند. برخی از آنها در حال پیاده‌روی هستند، در حالی که برخی دیگر در حال پیاده‌روی هستند. در طول خیابان، دو طرفین باز است و از طرفین به طرفین، افراد مختلفی در حال پیاده‌روی هستند. برخی از آنها در حال پیاده‌روی هستند، در حالی که برخی دیگر در حال پیاده‌روی هستند. در طول خیابان، دو طرفین باز است و از طرفین به طرفین، افراد مختلفی در حال پیاده‌روی هستند. برخی از آنها در حال پیاده‌روی هستند، در حالی که برخی دیگر در حال پیاده‌روی هستند. در طول خیابان، دو طرفین باز است و از طرفین به طرفین، افراد مختلفی در حال پیاده‌روی هستند. برخی از آنها در حال پیاده‌روی هستند، در حالی که برخی دیگر در حال پیاده‌روی هستند. در طول خیابان، دو طرفین باز است و از طرفین به طرفین، افراد مختلفی در حال پیاده‌روی هستند. برخی از آنها در حال پیاده‌روی هستند، در حالی که برخی دیگر در حال پیاده‌روی هستند. در طول خیابان، دو طرفین باز است و از طرفین به طرفین، افراد مختلفی در حال پیاده‌روی هستند. برخی از آنها در حال پیاده‌روی هستند، در حالی که برخی دیگر در حال پیاده‌روی هستند. در طول خیابان، دو طرفین باز است و از طرفین به طرفین، افراد مختلفی در حال پیاده‌روی هستند. برخی از آنها در حال پیاده‌روی هستند، در حالی که برخی دیگر در حال پیاده‌روی هستند. در طول خیابان، دو طرفین باز است و از طرفین به طرفین، افراد مختلفی در حال پیاده‌روی هستند. برخی از آنها در حال پیاده‌روی هستند، در حالی که برخی دیگر در حال پیاده‌روی هستند. در طول خیابان، دو طرفین باز است و از طرفین به
zachary-nelson-98Elr-LIvD8-unsplash.jpg,"The image depicts three young people jumping joyfully in a snowy outdoor setting. The main subjects are positioned in the foreground, with their arms raised high above their heads, suggesting a sense of excitement and freedom.   1. **Main Subjects and Actions**:    - The person on the left is wearing a gray jacket over a white t-shirt, blue jeans, and white sneakers with black stripes. They have curly hair and are smiling.    - The person in the middle is dressed in a denim jacket over a black t-shirt, black pants, and white sneakers. They are also smiling and appear to be in mid-air.    - The person on the right is wearing a black t-shirt, black pants, and black sneakers. They have short hair and are also smiling.  2. **Colors**:    - The individuals are dressed in casual winter clothing, including jackets, t-shirts, jeans, and sneakers.    - The snow-covered ground and trees add a white and gray color palette to the scene.    - The sky is clear with some clouds, indicating it might be a cold day but not overly dark.  3. **Lighting**:    - The lighting suggests it is daytime, likely late morning or early afternoon, given the brightness and the shadows cast by the subjects.  4. **Composition**:    - The subjects are centered in the frame, with the camera angle capturing them from the waist up.    - The background includes a sidewalk, a street with parked cars, and a building with a sign that reads ""Caution: Snow."" There are also bare trees and a clear sky.  5. **Background Elements**:    - The background features a sidewalk where the subjects are jumping.    - A street with several parked cars is visible behind the subjects.    - A building with a sign that says ""Caution: Snow"" is present.    - Bare trees indicate it is winter.    - The sky is clear with some clouds, suggesting a cold but sunny day.  6. **Spatial Relationships**:    - The subjects are in the foreground, jumping off the sidewalk.    - The street and parked cars are in the middle ground.    - The building and bare trees are in the background.  7. **Notable Details and Atmosphere**:    - The overall atmosphere is cheerful and energetic, with the subjects appearing to enjoy themselves despite the cold weather.    - The snow-covered ground and bare trees contribute to the wintry ambiance.    - The clear sky and bright lighting enhance the joyful mood of the scene.  This image captures a moment of happiness and camaraderie among friends in a snowy environment, emphasizing the contrast between the cold surroundings and the warmth of their shared experience.",در تصویر مشاهده می‌شود چهار نفر در حال پرش در برف است. این نفران به طور متفاوت لباس می‌پوشند:  1. نفر اول: پوششی شامل یک پالتو قهوه‌ای، یک شلوار جین آبی و کفش‌های سفید است. 2. نفر دوم: پوششی شامل یک پالتو آبی، یک شلوار جین سفید و کفش‌های سفید است. 3. نفر سوم: پوششی شامل یک پالتو سیاه، یک شلوار جین سفید و کفش‌های سفید است. 4. نفر چهارم: پوششی شامل یک پالتو سیاه، یک شلوار جین سفید و کفش‌های سفید است.  背景: - در پس‌زمینه، درختان برفی و خانه‌هایی با پوشش برفی مشاهده می‌شوند. - در حالی که در زمین برفی قرار دارند، در بالای آنها آسمانی سفید و بارانی است.  این تصویر به طور کلی در زمستانی است و نشان‌دهنده روزی است که برف سرشار است. نفران به طور خاص در حال پرش هستند، که به عنوان یک احساس خوشحالی یا فریاد نشان می‌دهد.
marissa-grootes-D4jRahaUaIc-unsplash.jpg,"The image depicts a neatly arranged collection of personal items, likely placed on a white surface. The central focus is a black quilted handbag with gold zippers and accents. Inside the bag, there is a gold iPhone with a white case, a white notebook with a black leather strap, and a gold watch with a black face.  Surrounding the handbag are various accessories: 1. **Sunglasses**: A pair of black sunglasses with a sleek design. 2. **Rings**: Three gold rings, one of which appears to be a wedding band. 3. **Watch**: A gold watch with a black face, similar in style to the one inside the bag. 4. **Lipstick**: A tube of red lipstick. 5. **Cosmetics**: A bottle of foundation or concealer, also in a clear plastic container. 6. **Nail Polish**: A small bottle of nail polish, possibly in a dark color. 7. **Bracelet**: A black bracelet with a gold clasp.  The overall composition is clean and organized, with each item placed deliberately to create a balanced and aesthetically pleasing arrangement. The lighting is bright and even, highlighting the metallic and leather textures of the items. The background is plain white, which helps to emphasize the colors and details of the objects. The overall atmosphere is one of elegance and sophistication, suggesting that these items belong to someone who values style and organization.",عذرًا، امکان نمایش یک تصویر وجود ندارد. لطفاً تصویر مورد نظر خود را ارسال کنید تا بتوانم به شما کمک کنم.
brooke-cagle-g1Kr4Ozfoac-unsplash.jpg,"The image depicts three women sitting at a wooden table in what appears to be a cozy, modern café or co-working space. The setting is characterized by a warm, inviting ambiance with soft lighting that highlights the subjects and their interactions.  1. **Main Subjects and Actions**:    - **Left Woman**: She has long, blonde hair and is wearing a light-colored sweater. She is seated on the left side of the table and is using a laptop computer. Her posture suggests she is engaged in some form of work or communication.    - **Middle Woman**: This woman has shoulder-length brown hair and is wearing a light brown sweater. She is smiling broadly and appears to be laughing or sharing something amusing with the other two women. Her body language indicates a sense of camaraderie and enjoyment.    - **Right Woman**: She has short, dark hair and is wearing glasses along with a denim jacket over a pink shirt. She is also smiling and seems to be in a jovial mood, possibly responding to the conversation or the content on the laptop screens.  2. **Colors**:    - The women are dressed in casual, comfortable clothing, which adds to the relaxed atmosphere of the scene.    - The table is wooden, contributing to the warm and rustic feel of the setting.    - The background features a dark, textured wall with subtle patterns, adding depth and contrast to the image.  3. **Lighting**:    - The lighting is soft and diffused, creating a gentle glow around the subjects. This lighting enhances the friendly and welcoming atmosphere of the scene.  4. **Composition**:    - The image is composed in a way that captures the interaction between the three women, with each person occupying a distinct space on the table.    - The camera angle is slightly elevated, providing a clear view of the table and the women's faces, emphasizing their expressions and body language.  5. **Background Elements**:    - Behind the women, there is a large, tall plant with long, slender leaves, adding a touch of greenery and natural beauty to the scene.    - The background wall features subtle, abstract patterns, which do not distract from the main subjects but add an artistic element to the overall composition.  6. **Notable Details and Atmosphere**:    - The overall atmosphere of the image is one of happiness and camaraderie, suggesting a positive and supportive environment.    - The casual attire of the women and the relaxed setting imply a comfortable and informal workspace or social gathering.    - The presence of laptops and notebooks indicates that the women might be working together on a project or discussing ideas, further enhancing the collaborative and productive vibe of the scene.  In summary, the image captures a moment of joy and connection among three women in a modern, cozy café setting, with a focus on their interactions and the warm, inviting atmosphere of the space.",در تصویر مشاهده می‌شود چهار نفر در حال گفتگو و کار با لپ‌تاپ‌هاستند. این افراد در یک میز قرار دارند که روی آن چند چوب و یک کتاب قرار دارد. در پشت آن‌ها یک دیوار سیاه با نقاشی‌های طبیعی و یک گیاه بزرگ قرار دارد. این افراد به طور متفاوت لباس می‌پوشند: یکی با لباس زرد، دیگری با لباس قهوه‌ای، سوم با لباس صورتی و چهارم با لباس قرمز و جکت جامه‌ای. هر کدام از این افراد یک لپ‌تاپ دارند و در حال کار با آن‌ها هستند. این تصویر به طور کلی در یک محیط کافی شاپ یا یک مکان مشترک برای کار و گفتگو است.
duy-pham-Cecb0_8Hx-o-unsplash.jpg,"The image depicts a group of seven people sitting on a boat, facing away from the camera. They appear to be enjoying a serene moment together, with their arms wrapped around each other in a gesture of camaraderie. The individuals are dressed casually, with some wearing hats and others in t-shirts.  The colors in the image are muted, with soft pastel tones dominating the scene. The sky is overcast, casting a diffused light that enhances the tranquil atmosphere. The background features a distant mountain range under a cloudy sky, adding depth and a sense of vastness to the scene.  In the distance, there is a cable car system visible, with several cabins suspended by cables. This adds an element of modernity to the otherwise natural setting. The water appears calm, reflecting the overcast sky and contributing to the overall peaceful ambiance.  The composition of the image is balanced, with the group of people centrally positioned, drawing the viewer's attention to their shared experience. The background elements, such as the mountains and the cable car, provide context and scale, grounding the scene in its environment.  Notable details include the casual attire of the individuals, which suggests a relaxed and informal gathering. The cable car system in the background introduces a touch of human-made infrastructure into the natural landscape, creating a contrast between nature and technology.  Overall, the image conveys a sense of unity, relaxation, and connection among the group members, set against a backdrop of natural beauty and subtle modernity.",عذرًا، امکان نمایش تصویر وجود ندارد. لطفاً تصویر را ارسال کنید تا بتوانم به شما کمک کنم.
